[
    {
        "quote": {
            "channel": "Destinygg",
            "text": "do people actually buy these PepoThink",
            "ts": "2019-03-24T01:08:22.000Z",
            "username": "kodaly",
            "searchAfter": 1553389702000
        },
        "date": "3/24/2019",
        "posted_date": "1/28/2026",
        "surrounds": "https://rustlesearch.dev/surrounds?channel=Destinygg&date=2019-03-24T01%3A08%3A22.000Z&username=kodaly"
    },
    {
        "quote": {
            "channel": "Destinygg",
            "text": "five AngelThump solo AngelThump q AngelThump games",
            "ts": "2018-05-03T04:30:01.000Z",
            "username": "kodaly",
            "searchAfter": 1525321801000
        },
        "date": "5/3/2018",
        "posted_date": "1/27/2026",
        "surrounds": "https://rustlesearch.dev/surrounds?channel=Destinygg&date=2018-05-03T04%3A30%3A01.000Z&username=kodaly"
    },
    {
        "quote": {
            "channel": "Destinygg",
            "text": "goodbye darius_irl DaFeels",
            "ts": "2018-03-26T00:20:36.000Z",
            "username": "kodaly",
            "searchAfter": 1522023636000
        },
        "date": "3/26/2018",
        "posted_date": "1/26/2026",
        "surrounds": "https://rustlesearch.dev/surrounds?channel=Destinygg&date=2018-03-26T00%3A20%3A36.000Z&username=kodaly"
    },
    {
        "quote": {
            "channel": "Destinygg",
            "text": "Intercourse probably not :)",
            "ts": "2018-06-24T00:21:52.000Z",
            "username": "kodaly",
            "searchAfter": 1529799712000
        },
        "date": "6/24/2018",
        "posted_date": "1/25/2026",
        "surrounds": "https://rustlesearch.dev/surrounds?channel=Destinygg&date=2018-06-24T00%3A21%3A52.000Z&username=kodaly"
    },
    {
        "quote": {
            "channel": "Destinygg",
            "text": "is he going to ride his bike down WhoahDude",
            "ts": "2018-09-11T02:57:26.000Z",
            "username": "kodaly",
            "searchAfter": 1536634646000
        },
        "date": "9/11/2018",
        "posted_date": "1/24/2026",
        "surrounds": "https://rustlesearch.dev/surrounds?channel=Destinygg&date=2018-09-11T02%3A57%3A26.000Z&username=kodaly"
    },
    {
        "quote": {
            "channel": "Destinygg",
            "text": "Lol you cucks are still complaining about \"sticky abusing\"",
            "ts": "2016-05-06T23:27:49.000Z",
            "username": "kodaly",
            "searchAfter": 1462577269000
        },
        "date": "5/6/2016",
        "posted_date": "1/23/2026",
        "surrounds": "https://rustlesearch.dev/surrounds?channel=Destinygg&date=2016-05-06T23%3A27%3A49.000Z&username=kodaly"
    },
    {
        "quote": {
            "channel": "Destinygg",
            "text": "a good idea FeelsGoodMan",
            "ts": "2018-10-23T00:09:04.000Z",
            "username": "kodaly",
            "searchAfter": 1540253344000
        },
        "date": "10/23/2018",
        "posted_date": "1/20/2026",
        "surrounds": "https://rustlesearch.dev/surrounds?channel=Destinygg&date=2018-10-23T00%3A09%3A04.000Z&username=kodaly"
    },
    {
        "quote": {
            "channel": "Destinygg",
            "text": "Destiny PLEASE ADD BLUE FACE NOSE UP",
            "ts": "2020-05-03T21:50:54.000Z",
            "username": "kodaly",
            "searchAfter": 1588542654000
        },
        "date": "5/3/2020",
        "posted_date": "1/19/2026",
        "surrounds": "https://rustlesearch.dev/surrounds?channel=Destinygg&date=2020-05-03T21%3A50%3A54.000Z&username=kodaly"
    },
    {
        "quote": {
            "channel": "Destinygg",
            "text": "wow im sure his sponsor really loves this LULW",
            "ts": "2020-09-28T22:53:43.000Z",
            "username": "kodaly",
            "searchAfter": 1601333623000
        },
        "date": "9/28/2020",
        "posted_date": "1/18/2026",
        "surrounds": "https://rustlesearch.dev/surrounds?channel=Destinygg&date=2020-09-28T22%3A53%3A43.000Z&username=kodaly"
    },
    {
        "quote": {
            "channel": "Destinygg",
            "text": "what is wrong with his colors?",
            "ts": "2016-04-30T22:28:17.000Z",
            "username": "kodaly",
            "searchAfter": 1462055297000
        },
        "date": "4/30/2016",
        "posted_date": "1/17/2026",
        "surrounds": "https://rustlesearch.dev/surrounds?channel=Destinygg&date=2016-04-30T22%3A28%3A17.000Z&username=kodaly"
    },
    {
        "quote": {
            "channel": "Destinygg",
            "text": "does anyone else feel like there is no point anymore and you should just give up DaFeels",
            "ts": "2020-07-31T13:27:58.000Z",
            "username": "kodaly",
            "searchAfter": 1596202078000
        },
        "date": "7/31/2020",
        "posted_date": "1/16/2026",
        "surrounds": "https://rustlesearch.dev/surrounds?channel=Destinygg&date=2020-07-31T13%3A27%3A58.000Z&username=kodaly"
    },
    {
        "quote": {
            "channel": "Destinygg",
            "text": "destiny this literally isn't worth it",
            "ts": "2018-07-19T21:01:20.000Z",
            "username": "kodaly",
            "searchAfter": 1532034080000
        },
        "date": "7/19/2018",
        "posted_date": "1/15/2026",
        "surrounds": "https://rustlesearch.dev/surrounds?channel=Destinygg&date=2018-07-19T21%3A01%3A20.000Z&username=kodaly"
    },
    {
        "quote": {
            "channel": "Destinygg",
            "text": "what about comebackyear",
            "ts": "2020-06-04T22:52:29.000Z",
            "username": "kodaly",
            "searchAfter": 1591311149000
        },
        "date": "6/4/2020",
        "posted_date": "1/14/2026",
        "surrounds": "https://rustlesearch.dev/surrounds?channel=Destinygg&date=2020-06-04T22%3A52%3A29.000Z&username=kodaly"
    },
    {
        "quote": {
            "channel": "Destinygg",
            "text": "Destiny he's talking to ben shapiro LUL",
            "ts": "2019-03-22T07:27:56.000Z",
            "username": "kodaly",
            "searchAfter": 1553239676000
        },
        "date": "3/22/2019",
        "posted_date": "1/13/2026",
        "surrounds": "https://rustlesearch.dev/surrounds?channel=Destinygg&date=2019-03-22T07%3A27%3A56.000Z&username=kodaly"
    },
    {
        "quote": {
            "channel": "Destinygg",
            "text": "STEVEN CROWDER IS A COMEDIAN LUL",
            "ts": "2019-09-07T23:43:10.000Z",
            "username": "kodaly",
            "searchAfter": 1567899790000
        },
        "date": "9/7/2019",
        "posted_date": "1/12/2026",
        "surrounds": "https://rustlesearch.dev/surrounds?channel=Destinygg&date=2019-09-07T23%3A43%3A10.000Z&username=kodaly"
    },
    {
        "quote": {
            "channel": "Destinygg",
            "text": "has dawigas ever made his own decision PepoThink",
            "ts": "2018-08-31T01:43:07.000Z",
            "username": "kodaly",
            "searchAfter": 1535679787000
        },
        "date": "8/31/2018",
        "posted_date": "1/11/2026",
        "surrounds": "https://rustlesearch.dev/surrounds?channel=Destinygg&date=2018-08-31T01%3A43%3A07.000Z&username=kodaly"
    },
    {
        "quote": {
            "channel": "Destinygg",
            "text": "destiny there is some memorization in math such as trigonometric identities",
            "ts": "2020-04-28T20:53:26.000Z",
            "username": "kodaly",
            "searchAfter": 1588107206000
        },
        "date": "4/28/2020",
        "posted_date": "1/10/2026",
        "surrounds": "https://rustlesearch.dev/surrounds?channel=Destinygg&date=2020-04-28T20%3A53%3A26.000Z&username=kodaly"
    },
    {
        "quote": {
            "channel": "Destinygg",
            "text": "never have I ever had sex",
            "ts": "2019-04-15T18:38:02.000Z",
            "username": "kodaly",
            "searchAfter": 1555353482000
        },
        "date": "4/15/2019",
        "posted_date": "1/9/2026",
        "surrounds": "https://rustlesearch.dev/surrounds?channel=Destinygg&date=2019-04-15T18%3A38%3A02.000Z&username=kodaly"
    },
    {
        "quote": {
            "channel": "Destinygg",
            "text": "can you not stay with bella?",
            "ts": "2018-10-31T01:57:02.000Z",
            "username": "kodaly",
            "searchAfter": 1540951022000
        },
        "date": "10/31/2018",
        "posted_date": "1/8/2026",
        "surrounds": "https://rustlesearch.dev/surrounds?channel=Destinygg&date=2018-10-31T01%3A57%3A02.000Z&username=kodaly"
    },
    {
        "quote": {
            "channel": "Destinygg",
            "text": "he ate a puppy DAFUK",
            "ts": "2019-04-06T05:11:52.000Z",
            "username": "kodaly",
            "searchAfter": 1554527512000
        },
        "date": "4/6/2019",
        "posted_date": "1/7/2026",
        "surrounds": "https://rustlesearch.dev/surrounds?channel=Destinygg&date=2019-04-06T05%3A11%3A52.000Z&username=kodaly"
    },
    {
        "quote": {
            "channel": "Destinygg",
            "text": "UNETHICAL HARDCORE CAMPAIGN REE UNETHICAL HARDCORE CAMPAIGN REE",
            "ts": "2019-08-16T23:33:39.000Z",
            "username": "kodaly",
            "searchAfter": 1565998419000
        },
        "date": "8/16/2019",
        "posted_date": "1/6/2026",
        "surrounds": "https://rustlesearch.dev/surrounds?channel=Destinygg&date=2019-08-16T23%3A33%3A39.000Z&username=kodaly"
    },
    {
        "quote": {
            "channel": "Destinygg",
            "text": "mfw destiny is literally just moving because of gwys",
            "ts": "2018-10-08T02:05:40.000Z",
            "username": "kodaly",
            "searchAfter": 1538964340000
        },
        "date": "10/8/2018",
        "posted_date": "1/5/2026",
        "surrounds": "https://rustlesearch.dev/surrounds?channel=Destinygg&date=2018-10-08T02%3A05%3A40.000Z&username=kodaly"
    },
    {
        "quote": {
            "channel": "Destinygg",
            "text": "unless you're a girl PEPE destiny",
            "ts": "2018-07-19T00:21:57.000Z",
            "username": "kodaly",
            "searchAfter": 1531959717000
        },
        "date": "7/19/2018",
        "posted_date": "1/4/2026",
        "surrounds": "https://rustlesearch.dev/surrounds?channel=Destinygg&date=2018-07-19T00%3A21%3A57.000Z&username=kodaly"
    },
    {
        "quote": {
            "channel": "Destinygg",
            "text": "That you will only suck dick at one, good thinking",
            "ts": "2016-06-06T17:54:03.000Z",
            "username": "kodaly",
            "searchAfter": 1465235643000
        },
        "date": "6/6/2016",
        "posted_date": "1/3/2026",
        "surrounds": "https://rustlesearch.dev/surrounds?channel=Destinygg&date=2016-06-06T17%3A54%3A03.000Z&username=kodaly"
    },
    {
        "quote": {
            "channel": "Destinygg",
            "text": "Steven L Buttersworth the Third PepeLaugh",
            "ts": "2019-10-18T18:50:47.000Z",
            "username": "kodaly",
            "searchAfter": 1571424647000
        },
        "date": "10/18/2019",
        "posted_date": "1/2/2026",
        "surrounds": "https://rustlesearch.dev/surrounds?channel=Destinygg&date=2019-10-18T18%3A50%3A47.000Z&username=kodaly"
    },
    {
        "quote": {
            "channel": "Destinygg",
            "text": "JohnPrestongc good to build credit",
            "ts": "2019-06-25T02:35:11.000Z",
            "username": "kodaly",
            "searchAfter": 1561430111000
        },
        "date": "6/25/2019",
        "posted_date": "1/1/2026",
        "surrounds": "https://rustlesearch.dev/surrounds?channel=Destinygg&date=2019-06-25T02%3A35%3A11.000Z&username=kodaly"
    },
    {
        "quote": {
            "channel": "Destinygg",
            "text": "daily cux FeelsGoodMan",
            "ts": "2019-05-25T01:35:24.000Z",
            "username": "kodaly",
            "searchAfter": 1558748124000
        },
        "date": "5/25/2019",
        "posted_date": "12/31/2025",
        "surrounds": "https://rustlesearch.dev/surrounds?channel=Destinygg&date=2019-05-25T01%3A35%3A24.000Z&username=kodaly"
    },
    {
        "quote": {
            "channel": "Destinygg",
            "text": "let's go destiny!!!!",
            "ts": "2020-03-18T20:47:19.000Z",
            "username": "kodaly",
            "searchAfter": 1584564439000
        },
        "date": "3/18/2020",
        "posted_date": "12/30/2025",
        "surrounds": "https://rustlesearch.dev/surrounds?channel=Destinygg&date=2020-03-18T20%3A47%3A19.000Z&username=kodaly"
    },
    {
        "quote": {
            "channel": "Destinygg",
            "text": "Goldilicous thanks for that info...",
            "ts": "2020-04-08T18:46:34.000Z",
            "username": "kodaly",
            "searchAfter": 1586371594000
        },
        "date": "4/8/2020",
        "posted_date": "12/29/2025",
        "surrounds": "https://rustlesearch.dev/surrounds?channel=Destinygg&date=2020-04-08T18%3A46%3A34.000Z&username=kodaly"
    },
    {
        "quote": {
            "channel": "Destinygg",
            "text": "DAILY DOSE OF KO",
            "ts": "2020-05-06T20:50:03.000Z",
            "username": "kodaly",
            "searchAfter": 1588798203000
        },
        "date": "5/6/2020",
        "posted_date": "12/28/2025",
        "surrounds": "https://rustlesearch.dev/surrounds?channel=Destinygg&date=2020-05-06T20%3A50%3A03.000Z&username=kodaly"
    },
    {
        "quote": {
            "channel": "Destinygg",
            "text": "desitny cubans are pretty red no?",
            "ts": "2018-05-31T21:09:10.000Z",
            "username": "kodaly",
            "searchAfter": 1527800950000
        },
        "date": "5/31/2018",
        "posted_date": "12/27/2025",
        "surrounds": "https://rustlesearch.dev/surrounds?channel=Destinygg&date=2018-05-31T21%3A09%3A10.000Z&username=kodaly"
    },
    {
        "quote": {
            "channel": "Destinygg",
            "text": "tfw my internet speed is 0.5 mbps :D",
            "ts": "2019-10-11T03:17:42.000Z",
            "username": "kodaly",
            "searchAfter": 1570763862000
        },
        "date": "10/11/2019",
        "posted_date": "12/26/2025",
        "surrounds": "https://rustlesearch.dev/surrounds?channel=Destinygg&date=2019-10-11T03%3A17%3A42.000Z&username=kodaly"
    },
    {
        "quote": {
            "channel": "Destinygg",
            "text": "isn't that what you do?",
            "ts": "2019-03-02T01:13:25.000Z",
            "username": "kodaly",
            "searchAfter": 1551489205000
        },
        "date": "3/2/2019",
        "posted_date": "12/25/2025",
        "surrounds": "https://rustlesearch.dev/surrounds?channel=Destinygg&date=2019-03-02T01%3A13%3A25.000Z&username=kodaly"
    },
    {
        "quote": {
            "channel": "Destinygg",
            "text": "MrMouton is looking for new porn, babies =new, MrMouton is looking for baby porn DAFUK",
            "ts": "2019-09-09T20:07:18.000Z",
            "username": "kodaly",
            "searchAfter": 1568059638000
        },
        "date": "9/9/2019",
        "posted_date": "12/24/2025",
        "surrounds": "https://rustlesearch.dev/surrounds?channel=Destinygg&date=2019-09-09T20%3A07%3A18.000Z&username=kodaly"
    },
    {
        "quote": {
            "channel": "Destinygg",
            "text": "he's mad LULW",
            "ts": "2020-05-10T19:01:26.000Z",
            "username": "kodaly",
            "searchAfter": 1589137286000
        },
        "date": "5/10/2020",
        "posted_date": "12/23/2025",
        "surrounds": "https://rustlesearch.dev/surrounds?channel=Destinygg&date=2020-05-10T19%3A01%3A26.000Z&username=kodaly"
    },
    {
        "quote": {
            "channel": "Destinygg",
            "text": "DariusIRL is in IT he could figure it out",
            "ts": "2020-06-12T23:19:36.000Z",
            "username": "kodaly",
            "searchAfter": 1592003976000
        },
        "date": "6/12/2020",
        "posted_date": "12/22/2025",
        "surrounds": "https://rustlesearch.dev/surrounds?channel=Destinygg&date=2020-06-12T23%3A19%3A36.000Z&username=kodaly"
    },
    {
        "quote": {
            "channel": "Destinygg",
            "text": "Acegickmo please leave you're being cringe",
            "ts": "2020-03-15T00:11:09.000Z",
            "username": "kodaly",
            "searchAfter": 1584231069000
        },
        "date": "3/15/2020",
        "posted_date": "12/21/2025",
        "surrounds": "https://rustlesearch.dev/surrounds?channel=Destinygg&date=2020-03-15T00%3A11%3A09.000Z&username=kodaly"
    },
    {
        "quote": {
            "channel": "Destinygg",
            "text": "ArmandoEnjoysMen no he's just someone that was replying to their fight just now and people were linking his tweets here",
            "ts": "2019-08-14T03:52:36.000Z",
            "username": "kodaly",
            "searchAfter": 1565754756000
        },
        "date": "8/14/2019",
        "posted_date": "12/20/2025",
        "surrounds": "https://rustlesearch.dev/surrounds?channel=Destinygg&date=2019-08-14T03%3A52%3A36.000Z&username=kodaly"
    },
    {
        "quote": {
            "channel": "Destinygg",
            "text": "teaching kids to make tnt? doesn't sounds like a very good idea to me destiny",
            "ts": "2020-07-31T02:25:56.000Z",
            "username": "kodaly",
            "searchAfter": 1596162356000
        },
        "date": "7/31/2020",
        "posted_date": "12/19/2025",
        "surrounds": "https://rustlesearch.dev/surrounds?channel=Destinygg&date=2020-07-31T02%3A25%3A56.000Z&username=kodaly"
    },
    {
        "quote": {
            "channel": "Destinygg",
            "text": "destiny did you atleast log him out LUL",
            "ts": "2018-08-13T19:47:36.000Z",
            "username": "kodaly",
            "searchAfter": 1534189656000
        },
        "date": "8/13/2018",
        "posted_date": "12/18/2025",
        "surrounds": "https://rustlesearch.dev/surrounds?channel=Destinygg&date=2018-08-13T19%3A47%3A36.000Z&username=kodaly"
    },
    {
        "quote": {
            "channel": "Destinygg",
            "text": "destiny could not contradict the fact that trump supports the wall LUL",
            "ts": "2019-06-03T02:54:09.000Z",
            "username": "kodaly",
            "searchAfter": 1559530449000
        },
        "date": "6/3/2019",
        "posted_date": "12/17/2025",
        "surrounds": "https://rustlesearch.dev/surrounds?channel=Destinygg&date=2019-06-03T02%3A54%3A09.000Z&username=kodaly"
    },
    {
        "quote": {
            "channel": "Destinygg",
            "text": "oiii fuck off m8",
            "ts": "2018-07-28T02:06:26.000Z",
            "username": "kodaly",
            "searchAfter": 1532743586000
        },
        "date": "7/28/2018",
        "posted_date": "12/16/2025",
        "surrounds": "https://rustlesearch.dev/surrounds?channel=Destinygg&date=2018-07-28T02%3A06%3A26.000Z&username=kodaly"
    },
    {
        "quote": {
            "channel": "Destinygg",
            "text": "_anon$ is gonna win GODSTINY",
            "ts": "2019-04-06T21:18:26.000Z",
            "username": "kodaly",
            "searchAfter": 1554585506000
        },
        "date": "4/6/2019",
        "posted_date": "12/15/2025",
        "surrounds": "https://rustlesearch.dev/surrounds?channel=Destinygg&date=2019-04-06T21%3A18%3A26.000Z&username=kodaly"
    },
    {
        "quote": {
            "channel": "Destinygg",
            "text": "backed up PepeLaugh",
            "ts": "2019-06-05T22:20:55.000Z",
            "username": "kodaly",
            "searchAfter": 1559773255000
        },
        "date": "6/5/2019",
        "posted_date": "12/14/2025",
        "surrounds": "https://rustlesearch.dev/surrounds?channel=Destinygg&date=2019-06-05T22%3A20%3A55.000Z&username=kodaly"
    },
    {
        "quote": {
            "channel": "Destinygg",
            "text": "DESITNY DO YOU THINK IT COULD BE YOUR SECRET DAUGHTER?",
            "ts": "2020-09-16T03:57:31.000Z",
            "username": "kodaly",
            "searchAfter": 1600228651000
        },
        "date": "9/16/2020",
        "posted_date": "12/12/2025",
        "surrounds": "https://rustlesearch.dev/surrounds?channel=Destinygg&date=2020-09-16T03%3A57%3A31.000Z&username=kodaly"
    },
    {
        "quote": {
            "channel": "Destinygg",
            "text": "SUPEROBNOXlOUSALLCAP :D my first party",
            "ts": "2019-04-04T18:15:19.000Z",
            "username": "kodaly",
            "searchAfter": 1554401719000
        },
        "date": "4/4/2019",
        "posted_date": "12/11/2025",
        "surrounds": "https://rustlesearch.dev/surrounds?channel=Destinygg&date=2019-04-04T18%3A15%3A19.000Z&username=kodaly"
    },
    {
        "quote": {
            "channel": "Destinygg",
            "text": "punished_furry i said hi and you said hi, what else should I do :(",
            "ts": "2020-09-11T07:15:24.000Z",
            "username": "kodaly",
            "searchAfter": 1599808524000
        },
        "date": "9/11/2020",
        "posted_date": "12/10/2025",
        "surrounds": "https://rustlesearch.dev/surrounds?channel=Destinygg&date=2020-09-11T07%3A15%3A24.000Z&username=kodaly"
    },
    {
        "quote": {
            "channel": "Destinygg",
            "text": "Does destiny play with a controller ?????????",
            "ts": "2016-04-28T04:42:33.000Z",
            "username": "kodaly",
            "searchAfter": 1461818553000
        },
        "date": "4/28/2016",
        "posted_date": "12/9/2025",
        "surrounds": "https://rustlesearch.dev/surrounds?channel=Destinygg&date=2016-04-28T04%3A42%3A33.000Z&username=kodaly"
    },
    {
        "quote": {
            "channel": "Destinygg",
            "text": "turn off cam then",
            "ts": "2020-03-28T05:41:16.000Z",
            "username": "kodaly",
            "searchAfter": 1585374076000
        },
        "date": "3/28/2020",
        "posted_date": "12/8/2025",
        "surrounds": "https://rustlesearch.dev/surrounds?channel=Destinygg&date=2020-03-28T05%3A41%3A16.000Z&username=kodaly"
    },
    {
        "quote": {
            "channel": "Destinygg",
            "text": "JAYL ok that one is actual cringe but this one is real funny https://www.reddit.com/r/TikTokCringe/comments/cvhkh1/lights_out/",
            "ts": "2019-08-26T04:52:07.000Z",
            "username": "kodaly",
            "searchAfter": 1566795127000
        },
        "date": "8/26/2019",
        "posted_date": "12/7/2025",
        "surrounds": "https://rustlesearch.dev/surrounds?channel=Destinygg&date=2019-08-26T04%3A52%3A07.000Z&username=kodaly"
    },
    {
        "quote": {
            "channel": "Destinygg",
            "text": "what is that white thing on the ground",
            "ts": "2018-10-23T02:46:51.000Z",
            "username": "kodaly",
            "searchAfter": 1540262811000
        },
        "date": "10/23/2018",
        "posted_date": "12/5/2025",
        "surrounds": "https://rustlesearch.dev/surrounds?channel=Destinygg&date=2018-10-23T02%3A46%3A51.000Z&username=kodaly"
    },
    {
        "quote": {
            "channel": "Destinygg",
            "text": "_anon$ computer science homework",
            "ts": "2019-04-08T19:06:14.000Z",
            "username": "kodaly",
            "searchAfter": 1554750374000
        },
        "date": "4/8/2019",
        "posted_date": "12/4/2025",
        "surrounds": "https://rustlesearch.dev/surrounds?channel=Destinygg&date=2019-04-08T19%3A06%3A14.000Z&username=kodaly"
    },
    {
        "quote": {
            "channel": "Destinygg",
            "text": "HIGH IQ MEME INC https://www.reddit.com/r/EngineeringStudents/comments/8moiel/why_would_e%CB%A3_do_this/",
            "ts": "2018-05-28T21:16:04.000Z",
            "username": "kodaly",
            "searchAfter": 1527542164000
        },
        "date": "5/28/2018",
        "posted_date": "12/3/2025",
        "surrounds": "https://rustlesearch.dev/surrounds?channel=Destinygg&date=2018-05-28T21%3A16%3A04.000Z&username=kodaly"
    },
    {
        "quote": {
            "channel": "Destinygg",
            "text": "Doesn't like Clinton, guess he is voting for TRUMPED",
            "ts": "2016-06-25T04:04:49.000Z",
            "username": "kodaly",
            "searchAfter": 1466827489000
        },
        "date": "6/25/2016",
        "posted_date": "12/2/2025",
        "surrounds": "https://rustlesearch.dev/surrounds?channel=Destinygg&date=2016-06-25T04%3A04%3A49.000Z&username=kodaly"
    },
    {
        "quote": {
            "channel": "Destinygg",
            "text": "JaydrVernanda >calculated risk LUL",
            "ts": "2018-07-08T00:23:16.000Z",
            "username": "kodaly",
            "searchAfter": 1531009396000
        },
        "date": "7/8/2018",
        "posted_date": "12/1/2025",
        "surrounds": "https://rustlesearch.dev/surrounds?channel=Destinygg&date=2018-07-08T00%3A23%3A16.000Z&username=kodaly"
    },
    {
        "quote": {
            "channel": "Destinygg",
            "text": "league 4v4 now",
            "ts": "2018-08-19T18:42:21.000Z",
            "username": "kodaly",
            "searchAfter": 1534704141000
        },
        "date": "8/19/2018",
        "posted_date": "11/30/2025",
        "surrounds": "https://rustlesearch.dev/surrounds?channel=Destinygg&date=2018-08-19T18%3A42%3A21.000Z&username=kodaly"
    },
    {
        "quote": {
            "channel": "Destinygg",
            "text": "MrMouton you should[ve just gotten a 1 door car since that's all you'll ever need <3",
            "ts": "2019-03-08T21:01:38.000Z",
            "username": "kodaly",
            "searchAfter": 1552078898000
        },
        "date": "3/8/2019",
        "posted_date": "11/29/2025",
        "surrounds": "https://rustlesearch.dev/surrounds?channel=Destinygg&date=2019-03-08T21%3A01%3A38.000Z&username=kodaly"
    },
    {
        "quote": {
            "channel": "Destinygg",
            "text": "destiny it's so dumb LUL",
            "ts": "2019-08-29T04:31:54.000Z",
            "username": "kodaly",
            "searchAfter": 1567053114000
        },
        "date": "8/29/2019",
        "posted_date": "11/28/2025",
        "surrounds": "https://rustlesearch.dev/surrounds?channel=Destinygg&date=2019-08-29T04%3A31%3A54.000Z&username=kodaly"
    },
    {
        "quote": {
            "channel": "Destinygg",
            "text": "two useless fields PEPE",
            "ts": "2018-07-10T19:14:29.000Z",
            "username": "kodaly",
            "searchAfter": 1531250069000
        },
        "date": "7/10/2018",
        "posted_date": "11/27/2025",
        "surrounds": "https://rustlesearch.dev/surrounds?channel=Destinygg&date=2018-07-10T19%3A14%3A29.000Z&username=kodaly"
    },
    {
        "quote": {
            "channel": "Destinygg",
            "text": "Jeb was robbed",
            "ts": "2019-07-17T22:31:15.000Z",
            "username": "kodaly",
            "searchAfter": 1563402675000
        },
        "date": "7/17/2019",
        "posted_date": "11/26/2025",
        "surrounds": "https://rustlesearch.dev/surrounds?channel=Destinygg&date=2019-07-17T22%3A31%3A15.000Z&username=kodaly"
    },
    {
        "quote": {
            "channel": "Destinygg",
            "text": ">be areyoushivering >be a nazi",
            "ts": "2018-08-24T06:59:51.000Z",
            "username": "kodaly",
            "searchAfter": 1535093991000
        },
        "date": "8/24/2018",
        "posted_date": "11/25/2025",
        "surrounds": "https://rustlesearch.dev/surrounds?channel=Destinygg&date=2018-08-24T06%3A59%3A51.000Z&username=kodaly"
    },
    {
        "quote": {
            "channel": "Destinygg",
            "text": "choco milk feelsamqa",
            "ts": "2018-04-12T01:05:20.000Z",
            "username": "kodaly",
            "searchAfter": 1523495120000
        },
        "date": "4/12/2018",
        "posted_date": "11/24/2025",
        "surrounds": "https://rustlesearch.dev/surrounds?channel=Destinygg&date=2018-04-12T01%3A05%3A20.000Z&username=kodaly"
    },
    {
        "quote": {
            "channel": "Destinygg",
            "text": "ArmandoEnjoysMen no that's just my bad skin",
            "ts": "2020-03-14T04:08:29.000Z",
            "username": "kodaly",
            "searchAfter": 1584158909000
        },
        "date": "3/14/2020",
        "posted_date": "11/23/2025",
        "surrounds": "https://rustlesearch.dev/surrounds?channel=Destinygg&date=2020-03-14T04%3A08%3A29.000Z&username=kodaly"
    },
    {
        "quote": {
            "channel": "Destinygg",
            "text": "DID YOU VISIT REM",
            "ts": "2019-08-28T22:37:34.000Z",
            "username": "kodaly",
            "searchAfter": 1567031854000
        },
        "date": "8/28/2019",
        "posted_date": "11/22/2025",
        "surrounds": "https://rustlesearch.dev/surrounds?channel=Destinygg&date=2019-08-28T22%3A37%3A34.000Z&username=kodaly"
    },
    {
        "quote": {
            "channel": "Destinygg",
            "text": "destiny that person could have gotten that from pence though",
            "ts": "2018-09-05T22:07:35.000Z",
            "username": "kodaly",
            "searchAfter": 1536185255000
        },
        "date": "9/5/2018",
        "posted_date": "11/21/2025",
        "surrounds": "https://rustlesearch.dev/surrounds?channel=Destinygg&date=2018-09-05T22%3A07%3A35.000Z&username=kodaly"
    },
    {
        "quote": {
            "channel": "Destinygg",
            "text": "kill him PepeLaugh",
            "ts": "2019-07-26T03:03:40.000Z",
            "username": "kodaly",
            "searchAfter": 1564110220000
        },
        "date": "7/26/2019",
        "posted_date": "11/20/2025",
        "surrounds": "https://rustlesearch.dev/surrounds?channel=Destinygg&date=2019-07-26T03%3A03%3A40.000Z&username=kodaly"
    },
    {
        "quote": {
            "channel": "Destinygg",
            "text": "WTF THAT'S MY LINE",
            "ts": "2020-03-27T23:30:14.000Z",
            "username": "kodaly",
            "searchAfter": 1585351814000
        },
        "date": "3/27/2020",
        "posted_date": "11/19/2025",
        "surrounds": "https://rustlesearch.dev/surrounds?channel=Destinygg&date=2020-03-27T23%3A30%3A14.000Z&username=kodaly"
    },
    {
        "quote": {
            "channel": "Destinygg",
            "text": "is nadush here",
            "ts": "2020-05-31T00:28:02.000Z",
            "username": "kodaly",
            "searchAfter": 1590884882000
        },
        "date": "5/31/2020",
        "posted_date": "11/18/2025",
        "surrounds": "https://rustlesearch.dev/surrounds?channel=Destinygg&date=2020-05-31T00%3A28%3A02.000Z&username=kodaly"
    },
    {
        "quote": {
            "channel": "Destinygg",
            "text": "destiny running low on funds SWEATSTINY",
            "ts": "2018-05-02T00:19:27.000Z",
            "username": "kodaly",
            "searchAfter": 1525220367000
        },
        "date": "5/2/2018",
        "posted_date": "11/17/2025",
        "surrounds": "https://rustlesearch.dev/surrounds?channel=Destinygg&date=2018-05-02T00%3A19%3A27.000Z&username=kodaly"
    },
    {
        "quote": {
            "channel": "Destinygg",
            "text": "austibbits shh don't talk so loud he is going to ban me if he sees me",
            "ts": "2020-04-27T19:36:37.000Z",
            "username": "kodaly",
            "searchAfter": 1588016197000
        },
        "date": "4/27/2020",
        "posted_date": "11/16/2025",
        "surrounds": "https://rustlesearch.dev/surrounds?channel=Destinygg&date=2020-04-27T19%3A36%3A37.000Z&username=kodaly"
    },
    {
        "quote": {
            "channel": "Destinygg",
            "text": "hentaititties dot org",
            "ts": "2018-10-03T19:26:34.000Z",
            "username": "kodaly",
            "searchAfter": 1538594794000
        },
        "date": "10/03/2018",
        "posted_date": "11/15/2025",
        "surrounds": "https://rustlesearch.dev/surrounds?channel=Destinygg&date=2018-10-03T19%3A26%3A34.000Z&username=kodaly"
    },
    {
        "quote": {
            "channel": "Destinygg",
            "text": "Is this Athene?",
            "ts": "2016-03-21T04:03:06.000Z",
            "username": "kodaly",
            "searchAfter": 1458532986000
        },
        "date": "3/21/2016",
        "posted_date": "11/14/2025",
        "surrounds": "https://rustlesearch.dev/surrounds?channel=Destinygg&date=2016-03-21T04%3A03%3A06.000Z&username=kodaly"
    },
    {
        "quote": {
            "channel": "Destinygg",
            "text": "Destiny only if you can do a wheely",
            "ts": "2018-09-02T21:56:23.000Z",
            "username": "kodaly",
            "searchAfter": 1535925383000
        },
        "date": "9/2/2018",
        "posted_date": "11/13/2025",
        "surrounds": "https://rustlesearch.dev/surrounds?channel=Destinygg&date=2018-09-02T21%3A56%3A23.000Z&username=kodaly"
    },
    {
        "quote": {
            "channel": "Destinygg",
            "text": "LAUGHING AT SOMEONES MENTAL ILLNESS LU",
            "ts": "2019-04-25T22:39:49.000Z",
            "username": "kodaly",
            "searchAfter": 1556231989000
        },
        "date": "4/25/2019",
        "posted_date": "11/12/2025",
        "surrounds": "https://rustlesearch.dev/surrounds?channel=Destinygg&date=2019-04-25T22%3A39%3A49.000Z&username=kodaly"
    },
    {
        "quote": {
            "channel": "Destinygg",
            "text": "destiny have you ever heard of the youtube ben dover?",
            "ts": "2018-04-25T01:12:06.000Z",
            "username": "kodaly",
            "searchAfter": 1524618726000
        },
        "date": "4/25/2018",
        "posted_date": "11/11/2025",
        "surrounds": "https://rustlesearch.dev/surrounds?channel=Destinygg&date=2018-04-25T01%3A12%3A06.000Z&username=kodaly"
    }
]